Name,Price,URL,Rating,Number of Reviews
ZOUK Black Floral Printed Handmade Vegan Leather Women's Office Bag for 15.6 inch Laptop with Double Handles - FloMotif,"1,699",https://www.amazon.in/FloMotif-Business-Shoulder-material-resistant/dp/B07NHYLTY7/ref=sr_1_105?crid=2M096C61O4MLT&keywords=bags&qid=1679597212&sprefix=ba%2Caps%2C283&sr=8-105,4.4 out of 5 stars,"1,852"
"Wesley Milestone 2.0 Casual Waterproof Laptop Backpack/Office Bag/School Bag/College Bag/Business Bag/Travel Backpack (Dimensions:13x18 inches) (Compatible with 39.62cm(15.6inch laptop) 30 L, Charcoal black",565,https://www.amazon.in/Wesley-Milestone-Waterproof-Backpack-Business/dp/B085S444JV/ref=sr_1_106?crid=2M096C61O4MLT&keywords=bags&qid=1679597212&sprefix=ba%2Caps%2C283&sr=8-106,4.3 out of 5 stars,"9,853"
The House of Tara Beige Canvas Casual Travel College Office Dual Compartment 18 litres Laptop Backpack for Men and Women (HTBP 138_Beige),"1,470",https://www.amazon.in/sspa/click?ie=UTF8&spc=MTo4MjM5ODExNDk2MDY2MjgwOjE2Nzk1OTcyMTI6c3BfbXRmOjIwMDc4NzU3MTc2MzA1OjowOjo&url=%2FHouse-Rugged-Unisex-Laptop-Backpack%2Fdp%2FB01MU76ZVF%2Fref%3Dsr_1_107_sspa%3Fcrid%3D2M096C61O4MLT%26keywords%3Dbags%26qid%3D1679597212%26sprefix%3Dba%252Caps%252C283%26sr%3D8-107-spons%26sp_csd%3Dd2lkZ2V0TmFtZT1zcF9tdGY%26psc%3D1,4.1 out of 5 stars,83
Half Moon 45L Hammer Waterproof Laptop Travelling Rucksack Trekking Backpack for Travel Journey bags for Men Women Boys & Girls with 17.3inch Laptop Compartment & Rain cover,"1,299",https://www.amazon.in/sspa/click?ie=UTF8&spc=MTo4MjM5ODExNDk2MDY2MjgwOjE2Nzk1OTcyMTI6c3BfbXRmOjIwMTMyMTIyMjQ4OTk4OjowOjo&url=%2FHalf-Moon-Waterproof-Laptop-Compartment%2Fdp%2FB09XLNNQC1%2Fref%3Dsr_1_108_sspa%3Fcrid%3D2M096C61O4MLT%26keywords%3Dbags%26qid%3D1679597212%26sprefix%3Dba%252Caps%252C283%26sr%3D8-108-spons%26sp_csd%3Dd2lkZ2V0TmFtZT1zcF9tdGY%26psc%3D1,4.1 out of 5 stars,"1,020"
Gear Moderneco5 21L Water Resistant School Bag/Backpack/College Bag For Men/Women - Navyblue,399,https://www.amazon.in/Gear-Ltrs-Casual-Backpack-MDBKPECO50504/dp/B0757K36YV/ref=sr_1_109?crid=2M096C61O4MLT&keywords=bags&qid=1679597212&sprefix=ba%2Caps%2C283&sr=8-109,3.9 out of 5 stars,"2,530"
POLICE Polyester 35 Ltr Laptop Big Low Spec Laptop Backpack - Black/Navy,"1,569",https://www.amazon.in/Police-Polyester-Laptop-Spec-Backpack/dp/B07ZB8NWTZ/ref=sr_1_110?crid=2M096C61O4MLT&keywords=bags&qid=1679597212&sprefix=ba%2Caps%2C283&sr=8-110,3.3 out of 5 stars,188
DZert Clasy Laptop Bag College Bag for Boys Girls 21 L Black,299,https://www.amazon.in/DZert-Polyester-Black-White-Laptop/dp/B07H193V57/ref=sr_1_111?crid=2M096C61O4MLT&keywords=bags&qid=1679597212&sprefix=ba%2Caps%2C283&sr=8-111,3.8 out of 5 stars,"2,294"
Amazon Brand - Solimo Sling Bag (Maroon),219,https://www.amazon.in/Amazon-Brand-Solimo-Sling-Maroon/dp/B07S63LC4P/ref=sr_1_112?crid=2M096C61O4MLT&keywords=bags&qid=1679597212&sprefix=ba%2Caps%2C283&sr=8-112,3.9 out of 5 stars,240
Bagneeds Men's Black Synthetic Leather Briefcase Best Laptop Messenger Bag Satchel for Men,545,https://www.amazon.in/Bagneeds-Synthetic-Leather-Briefcase-Messenger/dp/B0855F8174/ref=sr_1_113?crid=2M096C61O4MLT&keywords=bags&qid=1679597212&sprefix=ba%2Caps%2C283&sr=8-113,4.1 out of 5 stars,"3,870"
"Lenovo 15.6"" Professional Backpack, Made in India, Water-resistant,Uncompromised storage, Travel friendly:Fleece-lined PC compartment,Vented,Padded BackPanel & Adjustable shoulder straps,Luggage strap",907,https://www.amazon.in/Lenovo-Professional-Backpack-Water-resistant-Uncompromised/dp/B08R7S55H4/ref=sr_1_114?crid=2M096C61O4MLT&keywords=bags&qid=1679597212&sprefix=ba%2Caps%2C283&sr=8-114,4.2 out of 5 stars,715
"Bennett Casual Laptop Bag school bags for boys girls 15.6-inch, 25 LTR Office & College bags for mens Water Repellent Backpack for Men & Women (Black)",512,https://www.amazon.in/Bennett-15-6-inch-College-Repellent-Backpack/dp/B09WZHX3B1/ref=sr_1_115?crid=2M096C61O4MLT&keywords=bags&qid=1679597212&sprefix=ba%2Caps%2C283&sr=8-115,4.0 out of 5 stars,443
Red Lemon Polyester Bange Series 15.6inch Laptop Bag for Men 35 LTR Capacity Daily Office Bag for Men and Women Black (1903),"2,849",https://www.amazon.in/Red-Lemon-Polyester-15-6-inch-Waterproof/dp/B07XYY2FW4/ref=sr_1_116?crid=2M096C61O4MLT&keywords=bags&qid=1679597212&sprefix=ba%2Caps%2C283&sr=8-116,4.2 out of 5 stars,160
HEROZ Hammer Unisex Nylon 45 L Travel Laptop Backpack Water Resistant Slim Durable Fits Up to 17.3 Inch Laptop Notebook (All) (Grey & Navy Blue),"1,499",https://www.amazon.in/sspa/click?ie=UTF8&spc=MTo4MjM5ODExNDk2MDY2MjgwOjE2Nzk1OTcyMTI6c3BfYnRmOjIwMTEzNzg4MTc1Nzk4OjowOjo&url=%2FHEROZ-Hammer-Durable-Travel-Laptop%2Fdp%2FB07MCRFH6N%2Fref%3Dsr_1_117_sspa%3Fcrid%3D2M096C61O4MLT%26keywords%3Dbags%26qid%3D1679597212%26sprefix%3Dba%252Caps%252C283%26sr%3D8-117-spons%26sp_csd%3Dd2lkZ2V0TmFtZT1zcF9idGY%26psc%3D1,4.3 out of 5 stars,"7,738"
"Handmade Genuine Leather Backpack - Vintage Artisan Rucksack for School, Travel, Hiking | Rustic Daypack Knapsack Bookbag with Customizable Design","3,999",https://www.amazon.in/sspa/click?ie=UTF8&spc=MTo4MjM5ODExNDk2MDY2MjgwOjE2Nzk1OTcyMTI6c3BfYnRmOjIwMTMyMzE4ODE2NTk4OjowOjo&url=%2FHandmade-Genuine-Leather-Backpack-Customizable%2Fdp%2FB0BRYJZZ58%2Fref%3Dsr_1_118_sspa%3Fcrid%3D2M096C61O4MLT%26keywords%3Dbags%26qid%3D1679597212%26sprefix%3Dba%252Caps%252C283%26sr%3D8-118-spons%26sp_csd%3Dd2lkZ2V0TmFtZT1zcF9idGY%26psc%3D1,,
LOOKMUSTER (15.6 inch 30 L Casual Waterproof Laptop Backpack/Office Bag/School Bag/College Bag/Business Bag/Unisex Travel Backpack,598,https://www.amazon.in/sspa/click?ie=UTF8&spc=MToxNzI0MjY2Mjk3NjMxODM4OjE2Nzk1OTcyMzM6c3BfYXRmX25leHQ6MjAxMjkzNjA0MTI4OTg6OjA6Og&url=%2FCasual-Waterproof-Backpack-College-Business%2Fdp%2FB09WJ16LPN%2Fref%3Dsr_1_113_sspa%3Fcrid%3D2M096C61O4MLT%26keywords%3Dbags%26qid%3D1679597233%26sprefix%3Dba%252Caps%252C283%26sr%3D8-113-spons%26sp_csd%3Dd2lkZ2V0TmFtZT1zcF9hdGZfbmV4dA%26psc%3D1,3.7 out of 5 stars,4
Zilant Large 40L Laptop Backpack MultiPurpose Laptop Bag With RainCover For Men & Women Multipurpose Bag,799,https://www.amazon.in/sspa/click?ie=UTF8&spc=MToxNzI0MjY2Mjk3NjMxODM4OjE2Nzk1OTcyMzM6c3BfYXRmX25leHQ6MjAwOTMzMTY3NDIzOTg6OjA6Og&url=%2FZilant-Backpack-MultiPurpose-RainCover-Multipurpose%2Fdp%2FB0B7N9MNNV%2Fref%3Dsr_1_114_sspa%3Fcrid%3D2M096C61O4MLT%26keywords%3Dbags%26qid%3D1679597233%26sprefix%3Dba%252Caps%252C283%26sr%3D8-114-spons%26sp_csd%3Dd2lkZ2V0TmFtZT1zcF9hdGZfbmV4dA%26psc%3D1,3.3 out of 5 stars,18
Wooum Water Resistant Material Sling Bag/One Side Bag/Shoulder Bag/Messenger Bag/Office Messenger Bag/Travel Side Bag with 14.1 Inch Laptop Compartment -,474,https://www.amazon.in/Wooum-Resistant-Material-Messenger-Compartment/dp/B09KV7Y3KL/ref=sr_1_115?crid=2M096C61O4MLT&keywords=bags&qid=1679597233&sprefix=ba%2Caps%2C283&sr=8-115,3.9 out of 5 stars,221
"Golden Wolf Laptop Bag Anti-theft Backpack with Lock College School Laptop Backpack with Rain Cover Water Resistant Business Backpack with USB Port for 15.6-inch Laptop 25 L Travel Bag for Men, Dark Grey","1,946",https://www.amazon.in/Hoteon-Backpack-Anti-Theft-Earphone-Resistant/dp/B08HM4TQZZ/ref=sr_1_116?crid=2M096C61O4MLT&keywords=bags&qid=1679597233&sprefix=ba%2Caps%2C283&sr=8-116,4.4 out of 5 stars,"3,252"
"Amazon Brand - Solimo Laptop Backpack for 15.6-inch Laptops (27 litres, Black)",539,https://www.amazon.in/Amazon-Brand-Backpack-15-6-inch-Laptops/dp/B076QFBFRG/ref=sr_1_117?crid=2M096C61O4MLT&keywords=bags&qid=1679597233&sprefix=ba%2Caps%2C283&sr=8-117,3.9 out of 5 stars,"1,243"
"HARISSONS Bags Delta 39 L Polyester Black 15.6 inch Laptop Backpack with Built-in Rain Cover & Anti-Sweat Air Mesh | Office, Travel and Casual Laptop Bag with Detailed Organizers for Men & Women","1,822",https://www.amazon.in/Harissons-Backpack-Abrassion-Integrated-backstaps/dp/B07PBKQXCZ/ref=sr_1_118?crid=2M096C61O4MLT&keywords=bags&qid=1679597233&sprefix=ba%2Caps%2C283&sr=8-118,4.2 out of 5 stars,"1,590"
Wooum Sling Cross Body Bag/One Side Bag/Shoulder Bag/Office Business Messenger Bag/Money Bag for Men and Women - Water Resisitance,328,https://www.amazon.in/Wooum-Resisitance-Shoulder-Business-Messenger/dp/B0993Q72WD/ref=sr_1_119?crid=2M096C61O4MLT&keywords=bags&qid=1679597233&sprefix=ba%2Caps%2C283&sr=8-119,4.0 out of 5 stars,618
Gear Casual Backpack,386,https://www.amazon.in/Gear-Black-Casual-Backpack-MDBKPECO50104/dp/B0757MBSS6/ref=sr_1_120?crid=2M096C61O4MLT&keywords=bags&qid=1679597233&sprefix=ba%2Caps%2C283&sr=8-120,3.8 out of 5 stars,"2,082"
"Amazon Basics - Laptop Backpack/College Bag/Travel Bag for 15.6-inch Laptop, Water-Resistant, Casual","2,159",https://www.amazon.in/Amazon-Basics-Professional-Backpack-15-inch-Laptop/dp/B09W4WB3K5/ref=sr_1_121?crid=2M096C61O4MLT&keywords=bags&qid=1679597233&sprefix=ba%2Caps%2C283&sr=8-121,3.5 out of 5 stars,5
NIVIA String Bag/Drawstring Bag/Sports Bag Boys/Polyester String Bag/Kit Bags/Drawstring Sports Bag/Dori Backpack/Gym Bag/String Bag Men Waterproof/Drawstring Backpack (Sky Blue),193,https://www.amazon.in/Nivia-5177SB-Polyester-String-Blue/dp/B071XMLFTL/ref=sr_1_122?crid=2M096C61O4MLT&keywords=bags&qid=1679597233&sprefix=ba%2Caps%2C283&sr=8-122,4.1 out of 5 stars,459
"uppercase 14 Ltrs Medium (14.6 inch) Laptop Backpack 2100EBP1 Roll Top Office - College 3x more water repellent sustainable bags with rain proof zippers for Men, Women, Boys and Girls, 750 Days warranty","1,000",https://www.amazon.in/sspa/click?ie=UTF8&spc=MToxNzI0MjY2Mjk3NjMxODM4OjE2Nzk1OTcyMzM6c3BfbXRmOjIwMDk3NTc5NTAxODk4OjowOjo&url=%2Fuppercase-Medium-Laptop-Backpack-2100EBP1%2Fdp%2FB0B68Y7H6F%2Fref%3Dsr_1_123_sspa%3Fcrid%3D2M096C61O4MLT%26keywords%3Dbags%26qid%3D1679597233%26sprefix%3Dba%252Caps%252C283%26sr%3D8-123-spons%26sp_csd%3Dd2lkZ2V0TmFtZT1zcF9tdGY%26psc%3D1,4.2 out of 5 stars,126
EUME Iris 23 LTR Laptop Backpack for 14 inch Laptop - Blue Series,"2,199",https://www.amazon.in/sspa/click?ie=UTF8&spc=MToxNzI0MjY2Mjk3NjMxODM4OjE2Nzk1OTcyMzM6c3BfbXRmOjIwMTE0NDE0MjI5Mjk4OjowOjo&url=%2FEUME-Laptop-Backpack-Resistance-Charging%2Fdp%2FB07G13F54G%2Fref%3Dsr_1_124_sspa%3Fcrid%3D2M096C61O4MLT%26keywords%3Dbags%26qid%3D1679597233%26sprefix%3Dba%252Caps%252C283%26sr%3D8-124-spons%26sp_csd%3Dd2lkZ2V0TmFtZT1zcF9tdGY%26psc%3D1,4.2 out of 5 stars,140
"Lunar's Unisex 50L Water Resistant Office/Travel/Business Laptop Backpack, Bag for up to 17.3 inch Laptop/MacBook with rain Cover and 2 Large compartments","1,199",https://www.amazon.in/Lunars-Travel-Laptop-Bag-compartments/dp/B08NHL52MK/ref=sr_1_125?crid=2M096C61O4MLT&keywords=bags&qid=1679597233&sprefix=ba%2Caps%2C283&sr=8-125,4.0 out of 5 stars,"2,488"
"Artistix Talon Anti Theft Design Laptop Backpack, With USB Charging Port (46 Cm, 25L,Black)",999,https://www.amazon.in/Artistix-Backpack-Anti-Theft-Charging-Resistance/dp/B082PKX18C/ref=sr_1_126?crid=2M096C61O4MLT&keywords=bags&qid=1679597233&sprefix=ba%2Caps%2C283&sr=8-126,4.3 out of 5 stars,"2,967"
"BESTAQUA Large Capacity Cosmetic Travel Bag, Women's Makeup Travel Bag Portable Leather Cosmetics Bag, Makeup Storage Bags with Handle and Divider,Makeup Organizer Bags(Multi)",779,https://www.amazon.in/BESTAQUA-Capacity-Cosmetic-Cosmetics-Organizer/dp/B0BW62ZR8N/ref=sr_1_127?crid=2M096C61O4MLT&keywords=bags&qid=1679597233&sprefix=ba%2Caps%2C283&sr=8-127,3.0 out of 5 stars,2
Li-Ning Panther Double Zipper Polyester Badminton Kit Bag,999,https://www.amazon.in/Li-Ning-Panther-Double-Polyester-Badminton/dp/B09VDQDXWN/ref=sr_1_128?crid=2M096C61O4MLT&keywords=bags&qid=1679597233&sprefix=ba%2Caps%2C283&sr=8-128,4.3 out of 5 stars,319
motherly Diaper Bags for Mom Travel Basic Edition (Navy Blue),"1,536",https://www.amazon.in/Motherly-Diaper-Bags-Travel-Basic/dp/B07PKQ3WJZ/ref=sr_1_129?crid=2M096C61O4MLT&keywords=bags&qid=1679597233&sprefix=ba%2Caps%2C283&sr=8-129,4.5 out of 5 stars,"2,336"
Mi Business Casual 21L Water Resistant Laptop Backpack (Blue),"1,069",https://www.amazon.in/Business-Casual-Resistant-Laptop-Backpack/dp/B0862V2GKH/ref=sr_1_130?crid=2M096C61O4MLT&keywords=bags&qid=1679597233&sprefix=ba%2Caps%2C283&sr=8-130,4.4 out of 5 stars,"6,175"
Li-Ning Raider Max Double Zipper Polyester Badminton Kit Bag (Blue),"1,549",https://www.amazon.in/Li-Ning-Raider-Double-Polyester-Badminton/dp/B09VDQRFRV/ref=sr_1_131?crid=2M096C61O4MLT&keywords=bags&qid=1679597233&sprefix=ba%2Caps%2C283&sr=8-131,4.4 out of 5 stars,382
"SFANE Polyester 23 cms Navy Blue Gym Bag, Shoulder Bag, Sports Bag for Men & Women with Separate Shoes Compartment (Blue)",435,https://www.amazon.in/SFANE-Duffel-Shoulder-Women-Compartment/dp/B07ZC77WTW/ref=sr_1_132?crid=2M096C61O4MLT&keywords=bags&qid=1679597233&sprefix=ba%2Caps%2C283&sr=8-132,4.4 out of 5 stars,"3,173"
HA creation Large Laptop Backpack/Bag for Unisex Teens & Adults for College/Office/Travel/School Use in Multi-color | 30.5 cm x 18 cm x 46 cm.,499,https://www.amazon.in/sspa/click?ie=UTF8&spc=MToxNzI0MjY2Mjk3NjMxODM4OjE2Nzk1OTcyMzM6c3BfYnRmOjIwMTMxMjQxNjU3NDk4OjowOjo&url=%2Fcreation-Large-Laptop-Backpack-Multi-color%2Fdp%2FB09VL9BRYP%2Fref%3Dsr_1_133_sspa%3Fcrid%3D2M096C61O4MLT%26keywords%3Dbags%26qid%3D1679597233%26sprefix%3Dba%252Caps%252C283%26sr%3D8-133-spons%26sp_csd%3Dd2lkZ2V0TmFtZT1zcF9idGY%26psc%3D1,3.0 out of 5 stars,2
ROCKSTON Casual Waterproof 18.5 inch Laptop Backpack/Office Bag/School Bag/College Bag/Business Bag/Unisex Travel Backpack with 3 compartment,470,https://www.amazon.in/sspa/click?ie=UTF8&spc=MToxNzI0MjY2Mjk3NjMxODM4OjE2Nzk1OTcyMzM6c3BfYnRmOjIwMTI0NDYxNjkwNjk4OjowOjo&url=%2FROCKSTON-Waterproof-Backpack-Business-compartment%2Fdp%2FB0BL3DKPCX%2Fref%3Dsr_1_134_sspa%3Fcrid%3D2M096C61O4MLT%26keywords%3Dbags%26qid%3D1679597233%26sprefix%3Dba%252Caps%252C283%26sr%3D8-134-spons%26sp_csd%3Dd2lkZ2V0TmFtZT1zcF9idGY%26psc%3D1,,
XDDESIGN Trailwalker Business Multi Purpose Travel Backpack Laptop Bag,"3,199",https://www.amazon.in/sspa/click?ie=UTF8&spc=MToyMjAzMTY4MDI5MzA1NzYwOjE2Nzk1OTcyNDk6c3BfYXRmX25leHQ6MjAwNzE4NzMzNjQ5OTg6OjA6Og&url=%2FXDDESIGN-Trailwalker-Business-Travel-Backpack%2Fdp%2FB09DPP72Y3%2Fref%3Dsr_1_129_sspa%3Fcrid%3D2M096C61O4MLT%26keywords%3Dbags%26qid%3D1679597249%26sprefix%3Dba%252Caps%252C283%26sr%3D8-129-spons%26sp_csd%3Dd2lkZ2V0TmFtZT1zcF9hdGZfbmV4dA%26psc%3D1,4.2 out of 5 stars,5
"MOKOBARA The Work Backpack 15.6"" Inch Laptop | Travel Backpack For Men And Women","6,999",https://www.amazon.in/sspa/click?ie=UTF8&spc=MToyMjAzMTY4MDI5MzA1NzYwOjE2Nzk1OTcyNDk6c3BfYXRmX25leHQ6MjAxMTc3OTU4NzQ1OTg6OjA6Og&url=%2FMokobara-Backpack-Leather-Resistant-Laptop%2Fdp%2FB0B7X81X69%2Fref%3Dsr_1_130_sspa%3Fcrid%3D2M096C61O4MLT%26keywords%3Dbags%26qid%3D1679597249%26sprefix%3Dba%252Caps%252C283%26sr%3D8-130-spons%26sp_csd%3Dd2lkZ2V0TmFtZT1zcF9hdGZfbmV4dA%26psc%3D1%26smid%3DA2ZJIE4OXD710M,4.4 out of 5 stars,22
Li-Ning Raider Max Double Zipper Polyester Badminton Kit Bag (Blue),"1,549",https://www.amazon.in/Li-Ning-Raider-Double-Polyester-Badminton/dp/B09VDQRFRV/ref=sr_1_131?crid=2M096C61O4MLT&keywords=bags&qid=1679597249&sprefix=ba%2Caps%2C283&sr=8-131,4.4 out of 5 stars,382
"FUR JADEN 15.6 Inch Smart Laptop Backpack Bag With USB Charging Port, Anti Theft Pocket and Accessories Organiser for Men Women Boys Girls","1,399",https://www.amazon.in/FUR-JADEN-Backpack-Accessories-Organiser/dp/B0BSHBH9K2/ref=sr_1_132?crid=2M096C61O4MLT&keywords=bags&qid=1679597249&sprefix=ba%2Caps%2C283&sr=8-132,4.6 out of 5 stars,162
"Bennett Casual Laptop Bag school bags for boys girls 15.6-inch, 25 LTR Office & College bags for mens Water Repellent Backpack for Men & Women (GREY)",512,https://www.amazon.in/Bennett-15-6-inch-College-Repellent-Backpack/dp/B09WZKHSDR/ref=sr_1_133?crid=2M096C61O4MLT&keywords=bags&qid=1679597249&sprefix=ba%2Caps%2C283&sr=8-133,4.0 out of 5 stars,443
Gear Classic 20L Faux Leather Water Resistant Anti Theft Laptop Bag/Backpack for Men/Women-Black,999,https://www.amazon.in/Gear-Classic-Leather-Backpack-LBPCLSLTH0101/dp/B07G4D13LB/ref=sr_1_134?crid=2M096C61O4MLT&keywords=bags&qid=1679597249&sprefix=ba%2Caps%2C283&sr=8-134,4.4 out of 5 stars,"2,614"
Lenovo Casual Laptop Backpack B210 39.62 cm (15.6) -inch Water Repellent Grey,783,https://www.amazon.in/Lenovo-Laptop-Backpack-15-6-Inch-GX40Q17227/dp/B075Y6SRMG/ref=sr_1_135?crid=2M096C61O4MLT&keywords=bags&qid=1679597249&sprefix=ba%2Caps%2C283&sr=8-135,4.2 out of 5 stars,"54,845"
"TRAWOC 55 LTR Travel Backpack Daypack bag for Camping Hiking Trekking, English Blue, SHK014","1,417",https://www.amazon.in/TRAWOC-Backpack-Outdoor-Trekking-Rucksack/dp/B07XY6BFXJ/ref=sr_1_136?crid=2M096C61O4MLT&keywords=bags&qid=1679597249&sprefix=ba%2Caps%2C283&sr=8-136,4.2 out of 5 stars,"2,381"
"Artistix Alpine Business Class Series | Anti Theft Laptop Backpack (32 Litre, 15.6 inch) (Black)","1,783",https://www.amazon.in/Artistix-Alpine-Laptop-Backpack-Business/dp/B08SVV5HZY/ref=sr_1_137?crid=2M096C61O4MLT&keywords=bags&qid=1679597249&sprefix=ba%2Caps%2C283&sr=8-137,4.5 out of 5 stars,"1,039"
Lavie Women's Nova Tote Bag | Ladies Purse Handbag,999,https://www.amazon.in/YuvKuz-TM-Infocus-Digitizer-Assembly/dp/B07MXNWTB2/ref=sr_1_138?crid=2M096C61O4MLT&keywords=bags&qid=1679597249&sprefix=ba%2Caps%2C283&sr=8-138,4.2 out of 5 stars,"7,464"
Carriall Polyster Daypack Casual Water-resistant Laptop Backpack/Office Bag/School Bag/College Bag/Business Bag/Unisex Travel Backpack,"3,199",https://www.amazon.in/sspa/click?ie=UTF8&spc=MToyMjAzMTY4MDI5MzA1NzYwOjE2Nzk1OTcyNDk6c3BfbXRmOjIwMTMwMDUyNTg4NTk4OjowOjo&url=%2FCarriall-Polyster-Water-resistant-Backpack-Business%2Fdp%2FB0BBLLN3VX%2Fref%3Dsr_1_139_sspa%3Fcrid%3D2M096C61O4MLT%26keywords%3Dbags%26qid%3D1679597249%26sprefix%3Dba%252Caps%252C283%26sr%3D8-139-spons%26sp_csd%3Dd2lkZ2V0TmFtZT1zcF9tdGY%26psc%3D1,4.5 out of 5 stars,2
Lavie Sport Chairman Laptop Bag | Premium Leatherette Business Backpack for Men & Women | Durable Office Bag for Notebook/MacBook,999,https://www.amazon.in/sspa/click?ie=UTF8&spc=MToyMjAzMTY4MDI5MzA1NzYwOjE2Nzk1OTcyNDk6c3BfbXRmOjIwMTA4NTk1NTk4MDk4OjowOjo&url=%2FLavie-Sport-Chairman-Compatible-compartments%2Fdp%2FB0B45SWK51%2Fref%3Dsr_1_140_sspa%3Fcrid%3D2M096C61O4MLT%26keywords%3Dbags%26qid%3D1679597249%26sprefix%3Dba%252Caps%252C283%26sr%3D8-140-spons%26sp_csd%3Dd2lkZ2V0TmFtZT1zcF9tdGY%26psc%3D1,4.0 out of 5 stars,736
"AirCase Laptop bag Anti Theft Backpack for Office College & Travel fits upto 15.6"" Laptop/Macbook, Waterproof, Durable, Multi-Pockets, 180° open (Black)- 1 Yr warranty","1,199",https://www.amazon.in/Aircase-Backpack-Rucksack-Anti-Theft-Charging/dp/B07SX3X79F/ref=sr_1_141?crid=2M096C61O4MLT&keywords=bags&qid=1679597249&sprefix=ba%2Caps%2C283&sr=8-141,4.3 out of 5 stars,160
Lunar's Bingo - 48 L Laptop Office/School/Travel/Business Backpack Water Resistant - Fits Up to 15.6 Inch Laptop Notebook with 1 Year Warranty,899,https://www.amazon.in/Lunars-Bingo-Laptop-Resistant-48L/dp/B08YZ5XY31/ref=sr_1_142?crid=2M096C61O4MLT&keywords=bags&qid=1679597249&sprefix=ba%2Caps%2C283&sr=8-142,3.9 out of 5 stars,"9,075"
"Storite Vintage Canvas Laptop Backpack for Women Men, School College Bag with USB Charging Port Fashion Backpack Fits 14Inch Notebook, (Brown,30x12x41 Cm)",749,https://www.amazon.in/Storite-Canvas-Backpack-Charging-Brown/dp/B0B7XBZYFS/ref=sr_1_143?crid=2M096C61O4MLT&keywords=bags&qid=1679597249&sprefix=ba%2Caps%2C283&sr=8-143,3.3 out of 5 stars,7
"Half Moon Curiosity 35L Water Resistant 15.6"" Laptop Bag for Men/Backpack for Men, Black | Office Bag for Men/Office Bag for Women with Padded Laptop Compartment | Rain Cover & Slim Durable Backpack",849,https://www.amazon.in/Half-Moon-Curiosity-Backpack-Resistant/dp/B09S3ZK3N1/ref=sr_1_144?crid=2M096C61O4MLT&keywords=bags&qid=1679597249&sprefix=ba%2Caps%2C283&sr=8-144,3.7 out of 5 stars,170
"Safari Seek 32 Ltrs Overnighter Travel Laptop Backpack (Blue), Water Resistant Spacious Bag for Travelling and Camping, All-Purpose Bag for Business & Leisure","1,939",https://www.amazon.in/Safari-Overnighter-Resistant-Travelling-All-Purpose/dp/B097JM98M1/ref=sr_1_145?crid=2M096C61O4MLT&keywords=bags&qid=1679597249&sprefix=ba%2Caps%2C283&sr=8-145,4.3 out of 5 stars,79
"House of Quirk Electronics Accessories Organizer Bag, Universal Carry Travel Gadget Bag for Cables, Plug and More, Perfect Size Fits for Pad Phone Charger Hard Disk - Dark Blue",499,https://www.amazon.in/House-Quirk-Electronics-Accessories-Organizer/dp/B07MMGBD1J/ref=sr_1_146?crid=2M096C61O4MLT&keywords=bags&qid=1679597249&sprefix=ba%2Caps%2C283&sr=8-146,4.3 out of 5 stars,"6,781"
F Gear Tycoon 27 Liters Laptop Backpack Sch Bag(Black),"1,168",https://www.amazon.in/F-Gear-Tycoon-Laptop-Backpack/dp/B071XJ6XV5/ref=sr_1_147?crid=2M096C61O4MLT&keywords=bags&qid=1679597249&sprefix=ba%2Caps%2C283&sr=8-147,4.4 out of 5 stars,221
ADISA 32L Large Laptop Backpack Office Bag College Travel Back Pack with rain Cover (Navy),599,https://www.amazon.in/ADISA-Laptop-Backpack-Office-College/dp/B0BVRJYD9Q/ref=sr_1_148?crid=2M096C61O4MLT&keywords=bags&qid=1679597249&sprefix=ba%2Caps%2C283&sr=8-148,4.5 out of 5 stars,6
The House of Tara Moss Green Canvas Casual Travel College Office Dual Compartment 18 litres Laptop Backpack for Men and Women (HTBP 164_Moss Green),"1,470",https://www.amazon.in/sspa/click?ie=UTF8&spc=MToyMjAzMTY4MDI5MzA1NzYwOjE2Nzk1OTcyNDk6c3BfYnRmOjIwMDY5MTY4MDE2OTA1OjowOjo&url=%2FHouse-Rugged-Unisex-Laptop-Backpack%2Fdp%2FB077KT4KJD%2Fref%3Dsr_1_149_sspa%3Fcrid%3D2M096C61O4MLT%26keywords%3Dbags%26qid%3D1679597249%26sprefix%3Dba%252Caps%252C283%26sr%3D8-149-spons%26sp_csd%3Dd2lkZ2V0TmFtZT1zcF9idGY%26psc%3D1,4.1 out of 5 stars,83
"Red Lemon Arctic Hunter Laptop Backpack with USB Charging for 15.6 Inch Laptop, Business Travel Bag with Luggage Strap, Water Resistant Backpack Casual Travel Backpack for Men & Woman","2,199",https://www.amazon.in/sspa/click?ie=UTF8&spc=MToyMjAzMTY4MDI5MzA1NzYwOjE2Nzk1OTcyNDk6c3BfYnRmOjIwMTIyOTI3MjUxODk4OjowOjo&url=%2FRed-Lemon-Backpack-Charging-Resistant%2Fdp%2FB09WYVR9Y1%2Fref%3Dsr_1_150_sspa%3Fcrid%3D2M096C61O4MLT%26keywords%3Dbags%26qid%3D1679597249%26sprefix%3Dba%252Caps%252C283%26sr%3D8-150-spons%26sp_csd%3Dd2lkZ2V0TmFtZT1zcF9idGY%26psc%3D1,3.8 out of 5 stars,24
THE CLOWNFISH Mark XXIX Extremis 27 liters Leatherette Mature Unisex Laptop Backpack for 14 inch Laptop Laptop Bakpack ( Mud Brown),"1,319",https://www.amazon.in/sspa/click?ie=UTF8&spc=MTo3NTI3OTcxMjY0NTY5ODk2OjE2Nzk1OTcyNjc6c3BfYXRmX25leHQ6MjAxMDg3MTI4NzA3OTg6OjA6Og&url=%2FClownfish-Extremis-liter-Laptop-Backpack%2Fdp%2FB07NSYD9H8%2Fref%3Dsr_1_145_sspa%3Fcrid%3D2M096C61O4MLT%26keywords%3Dbags%26qid%3D1679597267%26sprefix%3Dba%252Caps%252C283%26sr%3D8-145-spons%26sp_csd%3Dd2lkZ2V0TmFtZT1zcF9hdGZfbmV4dA%26psc%3D1,4.3 out of 5 stars,106
HEROZ Hammer Unisex Nylon 35 L Travel Laptop Backpack Water Resistant Slim Durable Fits Up to 17.3 Inch Laptop Notebook (Black & Navy Blue),"1,079",https://www.amazon.in/sspa/click?ie=UTF8&spc=MTo3NTI3OTcxMjY0NTY5ODk2OjE2Nzk1OTcyNjc6c3BfYXRmX25leHQ6MjAxMTM2NDg1ODYxOTg6OjA6Og&url=%2FHEROZ-Backpack-Resistant-Durable-Notebook%2Fdp%2FB09B672TX9%2Fref%3Dsr_1_146_sspa%3Fcrid%3D2M096C61O4MLT%26keywords%3Dbags%26qid%3D1679597267%26sprefix%3Dba%252Caps%252C283%26sr%3D8-146-spons%26sp_csd%3Dd2lkZ2V0TmFtZT1zcF9hdGZfbmV4dA%26psc%3D1,4.2 out of 5 stars,"1,087"
Protecta The Professional Laptop Bag Briefcase for Laptops with Screen Size Up to 15.6 Inch (Black & Indian Geometric Print),679,https://www.amazon.in/Protecta-Professional-15-6-inch-Briefcase-Geometric/dp/B07GNCRCP4/ref=sr_1_147?crid=2M096C61O4MLT&keywords=bags&qid=1679597267&sprefix=ba%2Caps%2C283&sr=8-147,4.4 out of 5 stars,"1,414"
DZert Clasy Laptop Bag College Bag for Boys Girls 21 L Nevy Blue,339,https://www.amazon.in/DZert-Girls-Polyester-White-Backpack/dp/B07H1BPCGQ/ref=sr_1_148?crid=2M096C61O4MLT&keywords=bags&qid=1679597267&sprefix=ba%2Caps%2C283&sr=8-148,3.8 out of 5 stars,"2,294"
"AirCase Laptop bag Anti Theft Backpack for Office College & Travel fits upto 15.6"" Laptop/Macbook, Waterproof, Durable, Multi-Pockets, 180° open (Black)- 1 Yr warranty","1,199",https://www.amazon.in/Aircase-Backpack-Rucksack-Anti-Theft-Charging/dp/B07SX3X79F/ref=sr_1_149?crid=2M096C61O4MLT&keywords=bags&qid=1679597267&sprefix=ba%2Caps%2C283&sr=8-149,4.3 out of 5 stars,160
"AirCase Office Messenger Sling Bag fits upto 15.6"" Laptop/Macbook, Detachable Shoulder Strap, Waterproof, Shockproof, Carry Handle with Spacious Pockets, For Men & Women, Blue- with Warranty",949,https://www.amazon.in/AirCase-C25-Messenger-Shoulder-Compartments/dp/B07X6DV3VM/ref=sr_1_150?crid=2M096C61O4MLT&keywords=bags&qid=1679597267&sprefix=ba%2Caps%2C283&sr=8-150,3.9 out of 5 stars,"1,267"
"Storite Vintage Canvas Laptop Backpack for Women Men, School College Bag with USB Charging Port Fashion Backpack Fits 14Inch Notebook, (Brown,30x12x41 Cm)",749,https://www.amazon.in/Storite-Canvas-Backpack-Charging-Brown/dp/B0B7XBZYFS/ref=sr_1_151?crid=2M096C61O4MLT&keywords=bags&qid=1679597267&sprefix=ba%2Caps%2C283&sr=8-151,3.3 out of 5 stars,7
ADISA 35L Large Laptop Backpack Office Bag College Travel Back Pack with rain Cover (Black),716,https://www.amazon.in/ADISA-Laptop-Backpack-Office-College/dp/B0BPTV3795/ref=sr_1_152?crid=2M096C61O4MLT&keywords=bags&qid=1679597267&sprefix=ba%2Caps%2C283&sr=8-152,3.9 out of 5 stars,37
"Safari Seek 32 Ltrs Overnighter Travel Laptop Backpack (Blue), Water Resistant Spacious Bag for Travelling and Camping, All-Purpose Bag for Business & Leisure","1,939",https://www.amazon.in/Safari-Overnighter-Resistant-Travelling-All-Purpose/dp/B097JM98M1/ref=sr_1_153?crid=2M096C61O4MLT&keywords=bags&qid=1679597267&sprefix=ba%2Caps%2C283&sr=8-153,4.3 out of 5 stars,79
"AirCase Sleeve Messenger Bag with Handle & Detachable Shoulder Strap |for Upto 14"" Laptop/ MacBook | 3-in-1 use | 3 Zippered Spacious Pockets | Durable Nylon Padded Fabric, for Men & Women (Black)",778,https://www.amazon.in/AirCase-C17-Laptop-Sleeve-Handle/dp/B07FJV79CX/ref=sr_1_154?crid=2M096C61O4MLT&keywords=bags&qid=1679597267&sprefix=ba%2Caps%2C283&sr=8-154,4.1 out of 5 stars,"1,216"
