Name,Price,URL,Rating,Number of Reviews
"uppercase Apex Professional Laptop Backpack (15.6 Inch) 3x more water resistant sustainable bags with rain proof zippers for Men, Women, Boys and Girls, 750 Days warranty","1,800",https://www.amazon.in/sspa/click?ie=UTF8&spc=MToxNjQ1NTc5MDA4MTUwMjgwOjE2Nzk1OTcwMzc6c3BfYXRmOjIwMTI1ODk5OTIwNjk4OjowOjo&url=%2Fuppercase-Professional-Backpack-resistant-sustainable%2Fdp%2FB0BWNBQXDZ%2Fref%3Dsr_1_1_sspa%3Fcrid%3D2M096C61O4MLT%26keywords%3Dbags%26qid%3D1679597037%26sprefix%3Dba%252Caps%252C283%26sr%3D8-1-spons%26sp_csd%3Dd2lkZ2V0TmFtZT1zcF9hdGY%26psc%3D1,4.9 out of 5 stars,18
"uppercase Matrix Professional Anti-theft Laptop Backpack (15.6 Inch) 3x more water resistant sustainable bags with rain proof zippers for Men, Women, Boys and Girls, 750 Days warranty","2,300",https://www.amazon.in/sspa/click?ie=UTF8&spc=MToxNjQ1NTc5MDA4MTUwMjgwOjE2Nzk1OTcwMzc6c3BfYXRmOjIwMTEyMDk2MzE3NTk4OjowOjo&url=%2Fuppercase-Professional-Anti-theft-resistant-sustainable%2Fdp%2FB0BSH4H4DB%2Fref%3Dsr_1_2_sspa%3Fcrid%3D2M096C61O4MLT%26keywords%3Dbags%26qid%3D1679597037%26sprefix%3Dba%252Caps%252C283%26sr%3D8-2-spons%26sp_csd%3Dd2lkZ2V0TmFtZT1zcF9hdGY%26psc%3D1,3.8 out of 5 stars,14
American Tourister 32 Ltrs Black Casual Backpack (AMT FIZZ SCH BAG 02 - BLACK),"1,199",https://www.amazon.in/American-Tourister-AMT-SCH-02/dp/B07CJCGM1M/ref=sr_1_3?crid=2M096C61O4MLT&keywords=bags&qid=1679597037&sprefix=ba%2Caps%2C283&sr=8-3,4.0 out of 5 stars,"52,374"
Skybags Brat Black 46 Cms Casual Backpack,669,https://www.amazon.in/Skybags-Brat-Black-Casual-Backpack/dp/B08Z1HHHTD/ref=sr_1_4?crid=2M096C61O4MLT&keywords=bags&qid=1679597037&sprefix=ba%2Caps%2C283&sr=8-4,4.1 out of 5 stars,"3,798"
Wesley Milestone 2.0 Casual Waterproof Laptop Backpack/Office Bag/School Bag/College Bag/Business Bag/Travel Backpack (Dimensions:13x18 inches) (Compatible with 39.62cm(15.6inch laptop) 30 L (Blue & black),565,https://www.amazon.in/Wesley-Milestone-Waterproof-Backpack-Business/dp/B084JGJ8PF/ref=sr_1_5?crid=2M096C61O4MLT&keywords=bags&qid=1679597037&sprefix=ba%2Caps%2C283&sr=8-5,4.3 out of 5 stars,"9,853"
ADISA 15.6 inch Laptop Backpack Office Bag College Travel Back Pack 32 Ltrs (z-Navy Blue),595,https://www.amazon.in/ADISA-Laptop-Backpack-Office-College/dp/B09TPX22NF/ref=sr_1_6?crid=2M096C61O4MLT&keywords=bags&qid=1679597037&sprefix=ba%2Caps%2C283&sr=8-6,3.9 out of 5 stars,574
Lavie Sport Lino Large Size 63 cms Wheel Duffle Bag for Travel | Travel Bag with Trolley,949,https://www.amazon.in/Lavie-Sport-Duffle-Luggage-Trolley/dp/B097RJ22Q3/ref=sr_1_7?crid=2M096C61O4MLT&keywords=bags&qid=1679597037&sprefix=ba%2Caps%2C283&sr=8-7,3.9 out of 5 stars,"6,349"
SAFARI 15 Ltrs Sea Blue Casual/School/College Backpack (DAYPACKNEO15CBSEB),299,https://www.amazon.in/SAFARI-Ltrs-Casual-Backpack-DAYPACKNEO15CBSEB/dp/B07Q7CNPMV/ref=sr_1_8?crid=2M096C61O4MLT&keywords=bags&qid=1679597037&sprefix=ba%2Caps%2C283&sr=8-8,4.0 out of 5 stars,"18,041"
Gear CarryOn 16L Foldable Water Resistant School Bag//Backpack/College Bag for Men/Women - Blue Black,214,https://www.amazon.in/GEAR-Black-Blue-Backpack-years/dp/B019HA8AYG/ref=sr_1_9?crid=2M096C61O4MLT&keywords=bags&qid=1679597037&sprefix=ba%2Caps%2C283&sr=8-9,3.7 out of 5 stars,"6,066"
"Half Moon 35L Water Resistant 15.6 inch Laptop Bag for Men/Backpack for Men, Navy Blue | Office Bag for Men/Office Bag for Women with Padded Laptop Compartment | Rain Cover & Reflective Strips",689,https://www.amazon.in/Half-Moon-Waterproof-Backpack-Students/dp/B085MHDJ93/ref=sr_1_10?crid=2M096C61O4MLT&keywords=bags&qid=1679597037&sprefix=ba%2Caps%2C283&sr=8-10,3.9 out of 5 stars,"15,282"
LOOKMUSTER Casual Waterproof Laptop Backpack/Office Bag/School Bag/College Bag/Business Bag/Travel Backpack,528,https://www.amazon.in/sspa/click?ie=UTF8&spc=MToxNjQ1NTc5MDA4MTUwMjgwOjE2Nzk1OTcwMzc6c3BfbXRmOjIwMTIxNDg5NjM4NDk4OjowOjo&url=%2FLOOKMUSTER-Waterproof-Backpack-College-Business%2Fdp%2FB0BS6YGKMC%2Fref%3Dsr_1_11_sspa%3Fcrid%3D2M096C61O4MLT%26keywords%3Dbags%26qid%3D1679597037%26sprefix%3Dba%252Caps%252C283%26sr%3D8-11-spons%26sp_csd%3Dd2lkZ2V0TmFtZT1zcF9tdGY%26psc%3D1,5.0 out of 5 stars,2
Lunar's Bingo - 48 L Laptop Office/School/Travel/Business Backpack Water Resistant - Fits Up to 15.6 Inch Laptop Notebook with 1 Year Warranty,899,https://www.amazon.in/sspa/click?ie=UTF8&spc=MToxNjQ1NTc5MDA4MTUwMjgwOjE2Nzk1OTcwMzc6c3BfbXRmOjIwMTI0NzI0NzkyODk4OjowOjo&url=%2FLunars-Bingo-Laptop-Resistant-48L%2Fdp%2FB08YZ5XY31%2Fref%3Dsr_1_12_sspa%3Fcrid%3D2M096C61O4MLT%26keywords%3Dbags%26qid%3D1679597037%26sprefix%3Dba%252Caps%252C283%26sr%3D8-12-spons%26sp_csd%3Dd2lkZ2V0TmFtZT1zcF9tdGY%26psc%3D1,3.9 out of 5 stars,"9,075"
Half Moon Large 37L Laptop Bag Backpack for menं Women Boys and Girls Luggage Travel Bags with 17.3 inches Laptop Compartment & Rain Cover,849,https://www.amazon.in/Half-Moon-Resistant-Backpack-Compartment/dp/B0BJ32LQ6X/ref=sr_1_13?crid=2M096C61O4MLT&keywords=bags&qid=1679597037&sprefix=ba%2Caps%2C283&sr=8-13,3.9 out of 5 stars,"2,352"
"Mi Step Out 12 L Mini Backpack (Small Size, Black, Water Repellant)",398,https://www.amazon.in/Backpack-Small-Black-Water-Repellant/dp/B088XB5XY8/ref=sr_1_14?crid=2M096C61O4MLT&keywords=bags&qid=1679597037&sprefix=ba%2Caps%2C283&sr=8-14,4.1 out of 5 stars,"8,221"
Wesley Milestone 15.6 inch 25 L Casual Waterproof Laptop Backpack/Office Bag/School Bag/College Bag/Business Bag/Unisex Travel Backpack,448,https://www.amazon.in/Wesley-Milestone-Waterproof-Backpack-Business/dp/B07PLKV6D1/ref=sr_1_15?crid=2M096C61O4MLT&keywords=bags&qid=1679597037&sprefix=ba%2Caps%2C283&sr=8-15,4.3 out of 5 stars,"12,366"
Gear Classic 20L Faux Leather Water Resistant Anti Theft Laptop Bag/Backpack for Men/Women-Brown,999,https://www.amazon.in/Gear-Classic-Leather-Backpack-LBPCLSLTH0201/dp/B07G4F6XFH/ref=sr_1_16?crid=2M096C61O4MLT&keywords=bags&qid=1679597037&sprefix=ba%2Caps%2C283&sr=8-16,4.4 out of 5 stars,"5,467"
"Safari Quill Laptop Backpack 26 Ltrs Water Resistant Fabric - Black, L (QUILL19CBBLK)",799,https://www.amazon.in/Safari-Laptop-Backpack-Resistant-Fabric/dp/B09B25Z8M2/ref=sr_1_17?crid=2M096C61O4MLT&keywords=bags&qid=1679597037&sprefix=ba%2Caps%2C283&sr=8-17,3.9 out of 5 stars,722
"FUR JADEN Anti Theft Number Lock Backpack Bag with 15.6 Inch Laptop Compartment, USB Charging Port & Organizer Pocket for Men Women Boys Girls",689,https://www.amazon.in/Number-Backpack-Compartment-Charging-Organizer/dp/B09VTCNN75/ref=sr_1_18?crid=2M096C61O4MLT&keywords=bags&qid=1679597037&sprefix=ba%2Caps%2C283&sr=8-18,3.9 out of 5 stars,"3,150"
ADISA Light Weight Laptop Backpack 32 Ltrs,595,https://www.amazon.in/ADISA-BP005-Weight-Casual-Backpack/dp/B07F3X45WZ/ref=sr_1_19?crid=2M096C61O4MLT&keywords=bags&qid=1679597037&sprefix=ba%2Caps%2C283&sr=8-19,4.0 out of 5 stars,"5,664"
"American Tourister VALEX BLUE LAPTOP BACKPACK 28 Ltrs,Volume, LAPTOP COMPARTMENT, BOTTLE POCKET, FRONT ORGANIZER","1,299",https://www.amazon.in/American-Tourister-BACKPACK-COMPARTMENT-ORGANIZER/dp/B0BTD4FK9G/ref=sr_1_20?crid=2M096C61O4MLT&keywords=bags&qid=1679597037&sprefix=ba%2Caps%2C283&sr=8-20,4.2 out of 5 stars,12
"Artistix Avian Unisex Water Repellent Anti Theft Travel Backpack with USB Port (Black, 32 L)","1,989",https://www.amazon.in/sspa/click?ie=UTF8&spc=MToxNjQ1NTc5MDA4MTUwMjgwOjE2Nzk1OTcwMzc6c3BfYnRmOjIwMDcyMzk1NTEyNzAyOjowOjo&url=%2FArtistix-Unisex-Travel-Backpack-Repellent%2Fdp%2FB09B5DMGM1%2Fref%3Dsr_1_21_sspa%3Fcrid%3D2M096C61O4MLT%26keywords%3Dbags%26qid%3D1679597037%26sprefix%3Dba%252Caps%252C283%26sr%3D8-21-spons%26sp_csd%3Dd2lkZ2V0TmFtZT1zcF9idGY%26psc%3D1,4.5 out of 5 stars,675
"uppercase Medium 17 Ltrs Vegan Leather (upto 14 inch) Laptop Backpack 2300EBP1 3x more water resistant sustainable bags with rain proof zippers for Men, Women, Boys and Girls, 750 Days warranty","1,600",https://www.amazon.in/sspa/click?ie=UTF8&spc=MToxNjQ1NTc5MDA4MTUwMjgwOjE2Nzk1OTcwMzc6c3BfYnRmOjIwMTI0MzExMDI0ODk4OjowOjo&url=%2Fuppercase-Backpack-2300EBP1-resistant-sustainable%2Fdp%2FB0BWNCV31F%2Fref%3Dsr_1_22_sspa%3Fcrid%3D2M096C61O4MLT%26keywords%3Dbags%26qid%3D1679597037%26sprefix%3Dba%252Caps%252C283%26sr%3D8-22-spons%26sp_csd%3Dd2lkZ2V0TmFtZT1zcF9idGY%26psc%3D1,4.0 out of 5 stars,375
"Chris & Kate Grey 16 Ltrs Water Resistant Polyester Backpack for School | College | With Laptop Compartment,",425,https://www.amazon.in/sspa/click?ie=UTF8&spc=MToxMjg5MjA0NzA0NjkxMjE0OjE2Nzk1OTcwNzE6c3BfYXRmX25leHQ6MjAwOTE3MDIwOTMzOTg6OjA6Og&url=%2FChris-Kate-Resistant-Polyester-Compartment%2Fdp%2FB0BKZL5ZR2%2Fref%3Dsr_1_17_sspa%3Fcrid%3D2M096C61O4MLT%26keywords%3Dbags%26qid%3D1679597071%26sprefix%3Dba%252Caps%252C283%26sr%3D8-17-spons%26sp_csd%3Dd2lkZ2V0TmFtZT1zcF9hdGZfbmV4dA%26psc%3D1,,
"uppercase SealPro Professional Laptop Backpack (15.6 Inch) 3x more water resistant sustainable bags with rain proof zippers & Anti-theft for Men, Women, Boys and Girls, 750 Days warranty","1,900",https://www.amazon.in/sspa/click?ie=UTF8&spc=MToxMjg5MjA0NzA0NjkxMjE0OjE2Nzk1OTcwNzE6c3BfYXRmX25leHQ6MjAxMDU3MTU4MjE1OTg6OjA6Og&url=%2Fuppercase-Professional-resistant-sustainable-Anti-theft%2Fdp%2FB0BR1C59R8%2Fref%3Dsr_1_18_sspa%3Fcrid%3D2M096C61O4MLT%26keywords%3Dbags%26qid%3D1679597071%26sprefix%3Dba%252Caps%252C283%26sr%3D8-18-spons%26sp_csd%3Dd2lkZ2V0TmFtZT1zcF9hdGZfbmV4dA%26psc%3D1,4.9 out of 5 stars,23
ADISA 35L Large Laptop Backpack Office Bag College Travel Back Pack with rain Cover (Grey),716,https://www.amazon.in/ADISA-Laptop-Backpack-Office-College/dp/B0BPVLXD53/ref=sr_1_19?crid=2M096C61O4MLT&keywords=bags&qid=1679597071&sprefix=ba%2Caps%2C283&sr=8-19,3.9 out of 5 stars,37
Fur Jaden Brown Textured Leatherette Stylish & Spacious Weekender Duffle Bag for Travel,889,https://www.amazon.in/FUR-JADEN-Leatherette-Polypropylene-DUFF05/dp/B07M9BRCQ5/ref=sr_1_20?crid=2M096C61O4MLT&keywords=bags&qid=1679597071&sprefix=ba%2Caps%2C283&sr=8-20,4.3 out of 5 stars,"5,570"
Half Moon Large 37L Laptop Bag Backpack for menं Women Boys and Girls Luggage Travel Bags with 17.3 inches Laptop Compartment & Rain Cover,849,https://www.amazon.in/Half-Moon-Backpack-Luggage-Compartment/dp/B09VCLZ3K4/ref=sr_1_21?crid=2M096C61O4MLT&keywords=bags&qid=1679597071&sprefix=ba%2Caps%2C283&sr=8-21,3.9 out of 5 stars,"2,352"
Gear Aspire 30L Water Restant Office Laptop Bag/Backpack for Men/Women/(Black),"1,131",https://www.amazon.in/Gear-Black-Laptop-Backpack-LBPASPIRE0104/dp/B075MK4TXP/ref=sr_1_22?crid=2M096C61O4MLT&keywords=bags&qid=1679597071&sprefix=ba%2Caps%2C283&sr=8-22,4.3 out of 5 stars,"5,184"
ADISA Laptop Backpack 31 Ltrs,595,https://www.amazon.in/ADISA-BP004-Weight-Casual-Backpack/dp/B07G3CG9FC/ref=sr_1_23?crid=2M096C61O4MLT&keywords=bags&qid=1679597071&sprefix=ba%2Caps%2C283&sr=8-23,4.0 out of 5 stars,"9,093"
"Fur Jaden 55 LTR Rucksack Travel Backpack Bag for Trekking, Hiking with Shoe Compartment",839,https://www.amazon.in/Rucksack-Travel-Backpack-Trekking-Compartment/dp/B07YDGQQN5/ref=sr_1_24?crid=2M096C61O4MLT&keywords=bags&qid=1679597071&sprefix=ba%2Caps%2C283&sr=8-24,4.2 out of 5 stars,"4,969"
"Genie Glitter Backpack for Women - 3 compartments, Laptop Bags for Girls, Stylish and Trendy College Backpacks for Girls, Water Resistant and Lightweight Bags for Office and Travelling Purpose.","1,099",https://www.amazon.in/Genie-Glitter-Backpack-Women-compartments/dp/B097JHQH13/ref=sr_1_25?crid=2M096C61O4MLT&keywords=bags&qid=1679597071&sprefix=ba%2Caps%2C283&sr=8-25,4.3 out of 5 stars,395
"Safari Flash Casual Backpack, 26 ltr Water Resistant Travel Bags| Weight Polyester Bagpack for Men and Women, Spacious Shoulder Bag for College, Office, Travelling and Camping",799,https://www.amazon.in/Safari-Backpack-Resistant-Polyester-Travelling/dp/B09B29F66W/ref=sr_1_26?crid=2M096C61O4MLT&keywords=bags&qid=1679597071&sprefix=ba%2Caps%2C283&sr=8-26,3.9 out of 5 stars,"2,444"
"uppercase Apex Professional Laptop Backpack (15.6 Inch) 3x more water resistant sustainable bags with rain proof zippers for Men, Women, Boys and Girls, 750 Days warranty","1,800",https://www.amazon.in/sspa/click?ie=UTF8&spc=MToxMjg5MjA0NzA0NjkxMjE0OjE2Nzk1OTcwNzE6c3BfbXRmOjIwMTA1NDUxODUxNTk4OjowOjo&url=%2Fuppercase-Professional-Backpack-resistant-sustainable%2Fdp%2FB0BR1D4SL1%2Fref%3Dsr_1_27_sspa%3Fcrid%3D2M096C61O4MLT%26keywords%3Dbags%26qid%3D1679597071%26sprefix%3Dba%252Caps%252C283%26sr%3D8-27-spons%26sp_csd%3Dd2lkZ2V0TmFtZT1zcF9tdGY%26psc%3D1,4.9 out of 5 stars,18
"uppercase Medium 23 Ltrs Tall Boy (14.6 inch) Laptop Backpack 2500EBP1 3x more water resistant sustainable bag with rain proof zippers for Men, Women, Boys and Girls, 750 Days warranty","1,700",https://www.amazon.in/sspa/click?ie=UTF8&spc=MToxMjg5MjA0NzA0NjkxMjE0OjE2Nzk1OTcwNzE6c3BfbXRmOjIwMDY1NTMzNjg0Njk4OjowOjo&url=%2FPOLICE-ltrs-cms-backpack-PTO020008_1_black%2Fdp%2FB0B81YTTWS%2Fref%3Dsr_1_28_sspa%3Fcrid%3D2M096C61O4MLT%26keywords%3Dbags%26qid%3D1679597071%26sprefix%3Dba%252Caps%252C283%26sr%3D8-28-spons%26sp_csd%3Dd2lkZ2V0TmFtZT1zcF9tdGY%26psc%3D1,4.1 out of 5 stars,187
F Gear Luxur Brown 25 liter Laptop Backpack (2404),809,https://www.amazon.in/F-Gear-Luxur-Brown-Backpack/dp/B01F7AX9ZA/ref=sr_1_29?crid=2M096C61O4MLT&keywords=bags&qid=1679597071&sprefix=ba%2Caps%2C283&sr=8-29,4.4 out of 5 stars,"16,477"
"Mi Step Out 12 L Mini Backpack (Small Size, Dark Blue, Water Repellant)",312,https://www.amazon.in/Step-Backpack-Small-Water-Repellant/dp/B088XH1BP7/ref=sr_1_30?crid=2M096C61O4MLT&keywords=bags&qid=1679597071&sprefix=ba%2Caps%2C283&sr=8-30,4.1 out of 5 stars,"8,221"
Fur Jaden Anti Theft Backpack 15.6 Inch Laptop Bag with USB Charging Port,799,https://www.amazon.in/Fur-Jaden-Black-Waterproof-Backpack/dp/B078GLXMDY/ref=sr_1_31?crid=2M096C61O4MLT&keywords=bags&qid=1679597071&sprefix=ba%2Caps%2C283&sr=8-31,4.0 out of 5 stars,"10,766"
DEIN KLEIDER Men's Nylon Messenger Bag,349,https://www.amazon.in/Kleider-Travel-Business-Messenger-Shoulder/dp/B084ZHP97M/ref=sr_1_32?crid=2M096C61O4MLT&keywords=bags&qid=1679597071&sprefix=ba%2Caps%2C283&sr=8-32,4.0 out of 5 stars,"4,574"
"AirCase Laptop Bag Backpack Case Pouch for Laptop Backpack for Men & Women,Premium Vegan Leather",929,https://www.amazon.in/AirCase-C34-Laptop-Backpack-Women/dp/B07QN4KXWG/ref=sr_1_33?crid=2M096C61O4MLT&keywords=bags&qid=1679597071&sprefix=ba%2Caps%2C283&sr=8-33,3.9 out of 5 stars,753
TRAWOC 80L Travel Backpack for Men & Women Outdoor Sport Camp Hiking Trekking Bag Camping Rucksack,"2,380",https://www.amazon.in/TRAWOC-Backpack-Trekking-Rucksack-Warranty/dp/B0847PGZZM/ref=sr_1_34?crid=2M096C61O4MLT&keywords=bags&qid=1679597071&sprefix=ba%2Caps%2C283&sr=8-34,4.4 out of 5 stars,"6,943"
"Wesley Unisex Milestone Casual Waterproof Laptop Office School College Business Travel Backpack 25 L (Dimensions: 12.5x18 inches) (Compatible with 15.6 inch laptops), Navy Blue",448,https://www.amazon.in/Wesley-Milestone-Waterproof-Backpack-Business/dp/B07K8KLB3P/ref=sr_1_35?crid=2M096C61O4MLT&keywords=bags&qid=1679597071&sprefix=ba%2Caps%2C283&sr=8-35,4.3 out of 5 stars,"12,366"
Half Moon 45L Hammer Waterproof Laptop Travelling Rucksack Trekking Backpack for Travel Journey bags for Men Women Boys & Girls with 17.3inch Laptop Compartment & Rain cover,"1,299",https://www.amazon.in/Half-Moon-Trekking-Bags-Compartment/dp/B08PSX1LN9/ref=sr_1_36?crid=2M096C61O4MLT&keywords=bags&qid=1679597071&sprefix=ba%2Caps%2C283&sr=8-36,4.1 out of 5 stars,"1,020"
"SINOPACK BAG AND BACKPACK FOR LAPTOP, SCHOOL, 32 LITER (33cms x 22cms x 51cms)",499,https://www.amazon.in/sspa/click?ie=UTF8&spc=MToxMjg5MjA0NzA0NjkxMjE0OjE2Nzk1OTcwNzE6c3BfYnRmOjIwMDg0MTM4NDM5NTk4OjowOjo&url=%2FSINOPACK-BACKPACK-LAPTOP-SCHOOL-LITER%2Fdp%2FB0BGPFCN7L%2Fref%3Dsr_1_37_sspa%3Fcrid%3D2M096C61O4MLT%26keywords%3Dbags%26qid%3D1679597071%26sprefix%3Dba%252Caps%252C283%26sr%3D8-37-spons%26sp_csd%3Dd2lkZ2V0TmFtZT1zcF9idGY%26psc%3D1,5.0 out of 5 stars,1
Zilant Large 40L Laptop Backpack MultiPurpose Laptop Bag With RainCover For Men & Women Multipurpose Bag,799,https://www.amazon.in/sspa/click?ie=UTF8&spc=MToxMjg5MjA0NzA0NjkxMjE0OjE2Nzk1OTcwNzE6c3BfYnRmOjIwMDkzMzE2NzQyMjk4OjowOjo&url=%2FZilant-Backpack-MultiPurpose-RainCover-Multipurpose%2Fdp%2FB0B7N8KPVM%2Fref%3Dsr_1_38_sspa%3Fcrid%3D2M096C61O4MLT%26keywords%3Dbags%26qid%3D1679597071%26sprefix%3Dba%252Caps%252C283%26sr%3D8-38-spons%26sp_csd%3Dd2lkZ2V0TmFtZT1zcF9idGY%26psc%3D1,3.3 out of 5 stars,18
"uppercase 26 Ltrs Ryder Professional Laptop Backpack (15.6 Inch) 3x more water resistant sustainable bags with rain proof zippers for Men, Women, Boys and Girls, 750 Days warranty","2,400",https://www.amazon.in/sspa/click?ie=UTF8&spc=MTo0MTUwODU4Mzg3NDI5ODc6MTY3OTU5NzA5NzpzcF9hdGZfbmV4dDoyMDEwODQ3NTA3NDY5ODo6MDo6&url=%2Fuppercase-Professional-Backpack-resistant-sustainable%2Fdp%2FB0BRMWDNZ7%2Fref%3Dsr_1_33_sspa%3Fcrid%3D2M096C61O4MLT%26keywords%3Dbags%26qid%3D1679597097%26sprefix%3Dba%252Caps%252C283%26sr%3D8-33-spons%26sp_csd%3Dd2lkZ2V0TmFtZT1zcF9hdGZfbmV4dA%26psc%3D1,4.7 out of 5 stars,19
"uppercase SealPro Professional Laptop Backpack (15.6 Inch) 3x more water resistant sustainable bags with rain proof zippers & Anti-theft for Men, Women, Boys and Girls, 750 Days warranty","1,900",https://www.amazon.in/sspa/click?ie=UTF8&spc=MTo0MTUwODU4Mzg3NDI5ODc6MTY3OTU5NzA5NzpzcF9hdGZfbmV4dDoyMDEwNTQ1MTg1MTQ5ODo6MDo6&url=%2Fuppercase-Professional-resistant-sustainable-Anti-theft%2Fdp%2FB0BR179L65%2Fref%3Dsr_1_34_sspa%3Fcrid%3D2M096C61O4MLT%26keywords%3Dbags%26qid%3D1679597097%26sprefix%3Dba%252Caps%252C283%26sr%3D8-34-spons%26sp_csd%3Dd2lkZ2V0TmFtZT1zcF9hdGZfbmV4dA%26psc%3D1,4.9 out of 5 stars,23
"Dell Pro Slim Backpack 15 - PO1520PS - Fits Most laptops up to 38.1 cm (15 inches, Black)","1,599",https://www.amazon.in/Dell-Pro-Slim-Backpack-15/dp/B07PMQTB6T/ref=sr_1_35?crid=2M096C61O4MLT&keywords=bags&qid=1679597097&sprefix=ba%2Caps%2C283&sr=8-35,4.3 out of 5 stars,401
Wesley Spartan Unisex Travel Hiking Laptop Bag fits Upto 17.3 inch with Raincover and Internal Organiser Backpack Rucksack College Bag,748,https://www.amazon.in/Wesley-Spartan-Hiking-Raincover-Organiser/dp/B098QFF5TJ/ref=sr_1_36?crid=2M096C61O4MLT&keywords=bags&qid=1679597097&sprefix=ba%2Caps%2C283&sr=8-36,4.1 out of 5 stars,"1,052"
"Lenovo 15.6"" (39.62cm) Slim Everyday Backpack, Made in India, Compact, Water-resistant, Organized storage:Laptop sleeve,tablet pocket,front workstation,2-side pockets,Padded adjustable shoulder straps",652,https://www.amazon.in/Lenovo-15-6-Inches-Everyday-Backpack/dp/B08R7RPVJF/ref=sr_1_37?crid=2M096C61O4MLT&keywords=bags&qid=1679597097&sprefix=ba%2Caps%2C283&sr=8-37,4.4 out of 5 stars,"2,738"
ADISA 35L Large Laptop Backpack Office Bag College Travel Back Pack with rain Cover (Green),716,https://www.amazon.in/ADISA-Laptop-Backpack-Office-College/dp/B0BPVCBFM7/ref=sr_1_38?crid=2M096C61O4MLT&keywords=bags&qid=1679597097&sprefix=ba%2Caps%2C283&sr=8-38,3.9 out of 5 stars,37
American Tourister Casual Backpack,"1,139",https://www.amazon.in/American-Tourister-AMT-SCH-BAG01/dp/B07CJCFNZG/ref=sr_1_39?crid=2M096C61O4MLT&keywords=bags&qid=1679597097&sprefix=ba%2Caps%2C283&sr=8-39,4.1 out of 5 stars,"14,490"
"Safari Quill Laptop Backpack 26 Ltrs Water Resistant Fabric - Blue, L (QUILL19CBBLU)",799,https://www.amazon.in/Safari-Laptop-Backpack-Resistant-Fabric/dp/B09B28TKLG/ref=sr_1_40?crid=2M096C61O4MLT&keywords=bags&qid=1679597097&sprefix=ba%2Caps%2C283&sr=8-40,4.1 out of 5 stars,496
Zipline Unisex casual polyester 36 L Backpack School Bag Women Men Boys Girls children Daypack College Bag Book School Sports Bag Weekend Bag,834,https://www.amazon.in/ZIPLINE-Polyester-Backpack-Children-Daypack/dp/B07XVMR33Q/ref=sr_1_41?crid=2M096C61O4MLT&keywords=bags&qid=1679597097&sprefix=ba%2Caps%2C283&sr=8-41,4.0 out of 5 stars,"5,151"
NIVIA Basic Duffle Polyester Bag/Gym Bags/Adjustable Shoulder Bag for Men/Duffle Gym Bags for Men/Fitness Bag/Carry Bags/Sports & Travel Bag/Sports Kit/Duffle Bags Travel,239,https://www.amazon.in/Nivia-6853BKGR-Polyester-Black-Grey/dp/B07NLB6FRS/ref=sr_1_42?crid=2M096C61O4MLT&keywords=bags&qid=1679597097&sprefix=ba%2Caps%2C283&sr=8-42,4.0 out of 5 stars,"3,130"
The Clownfish Tramp 33 Litre Water Resistant Polyester Two Wheel Laptop Trolley Backpack (Black- Size 48 Cm),"5,699",https://www.amazon.in/sspa/click?ie=UTF8&spc=MTo0MTUwODU4Mzg3NDI5ODc6MTY3OTU5NzA5NzpzcF9tdGY6MjAwODAyODgyMjU5OTg6OjA6Og&url=%2FClownfish-Resistant-Polyester-Trolley-Backpack%2Fdp%2FB0BFL7SVSM%2Fref%3Dsr_1_43_sspa%3Fcrid%3D2M096C61O4MLT%26keywords%3Dbags%26qid%3D1679597097%26sprefix%3Dba%252Caps%252C283%26sr%3D8-43-spons%26sp_csd%3Dd2lkZ2V0TmFtZT1zcF9tdGY%26psc%3D1,5.0 out of 5 stars,2
"MOKOBARA Backpack 15.5"" Inch Laptop Backpack For Women (16 litres ) Improved (2022 - Model)","4,499",https://www.amazon.in/sspa/click?ie=UTF8&spc=MTo0MTUwODU4Mzg3NDI5ODc6MTY3OTU5NzA5NzpzcF9tdGY6MjAxMTc3OTU4NzY5OTg6OjA6Og&url=%2FMOKOBARA-TSBPK12CND22001-Backpack-Modern-Love%2Fdp%2FB08T1769X9%2Fref%3Dsr_1_44_sspa%3Fcrid%3D2M096C61O4MLT%26keywords%3Dbags%26qid%3D1679597097%26sprefix%3Dba%252Caps%252C283%26sr%3D8-44-spons%26sp_csd%3Dd2lkZ2V0TmFtZT1zcF9tdGY%26psc%3D1%26smid%3DA2ZJIE4OXD710M,4.3 out of 5 stars,152
"Tabelito® Casual Laptop Bag 15.6inch (39.6 cm) , 25 LTR Office College School Bags Business Travel Backpack for Men Women Water Resistant Bags(BLACK)",549,https://www.amazon.in/Tabelito-Laptop-Backpack-15-6-inch-Repellent/dp/B08Y5S6C2P/ref=sr_1_45?crid=2M096C61O4MLT&keywords=bags&qid=1679597097&sprefix=ba%2Caps%2C283&sr=8-45,4.2 out of 5 stars,"1,603"
"Nivia 5227 Pulse Junior Bag, Others (Orange) (Sky Blue)",294,https://www.amazon.in/Nivia-5227-Pulse-Junior-Others/dp/B08D7QG33Z/ref=sr_1_46?crid=2M096C61O4MLT&keywords=bags&qid=1679597097&sprefix=ba%2Caps%2C283&sr=8-46,3.8 out of 5 stars,156
AUXTER Faux Leather 23 Cms Duffle Bag(AUX_GB_LE_Black -SE_0521_Black),376,https://www.amazon.in/AUXTER-BLACKY-Duffel-Emboss-Black/dp/B07F2H25NP/ref=sr_1_47?crid=2M096C61O4MLT&keywords=bags&qid=1679597097&sprefix=ba%2Caps%2C283&sr=8-47,4.3 out of 5 stars,"8,915"
AmazonBasics - Casual Backpack/Office Bag/ for a 15.6-inch Laptop,869,https://www.amazon.in/AmazonBasics-Casual-Backpack-Office-15-6-inch/dp/B09W4VMZ79/ref=sr_1_48?crid=2M096C61O4MLT&keywords=bags&qid=1679597097&sprefix=ba%2Caps%2C283&sr=8-48,4.2 out of 5 stars,436
Half Moon 30L Waterproof 15.6 inch Laptop Office School College Bag Backpack for Men Women Boys & Girls,589,https://www.amazon.in/Half-Moon-Waterproof-Laptop-Backpack/dp/B09QM9N1B3/ref=sr_1_49?crid=2M096C61O4MLT&keywords=bags&qid=1679597097&sprefix=ba%2Caps%2C283&sr=8-49,3.6 out of 5 stars,361
motherly Diaper Bags for Mom Travel Basic Edition (Black),"1,536",https://www.amazon.in/Motherly-Diaper-Travel-Basic-Black/dp/B07QXSNDKN/ref=sr_1_50?crid=2M096C61O4MLT&keywords=bags&qid=1679597097&sprefix=ba%2Caps%2C283&sr=8-50,4.5 out of 5 stars,"2,336"
"Wesley Unisex Milestone Casual Waterproof Laptop Office School College Business Travel Backpack 25 L (Dimensions: 12.5x18 inches) (Compatible with 15.6 inch laptops), Navy Blue",448,https://www.amazon.in/Wesley-Milestone-Waterproof-Backpack-Business/dp/B07K8KLB3P/ref=sr_1_51?crid=2M096C61O4MLT&keywords=bags&qid=1679597097&sprefix=ba%2Caps%2C283&sr=8-51,4.3 out of 5 stars,"12,366"
Gear Vintage2 Anti Theft Faux Leather 18 cms Tan Laptop Backpack,"1,075",https://www.amazon.in/Gear-Vintage2-Leather-Backpack-LBPVG2LTH1901/dp/B07G4F3758/ref=sr_1_52?crid=2M096C61O4MLT&keywords=bags&qid=1679597097&sprefix=ba%2Caps%2C283&sr=8-52,4.3 out of 5 stars,"1,463"
Red Lemon Unisex-adult Bange Series Rhombus Shell Design Waterproof Sling Bag with USB Charging,"1,899",https://www.amazon.in/sspa/click?ie=UTF8&spc=MTo0MTUwODU4Mzg3NDI5ODc6MTY3OTU5NzA5NzpzcF9idGY6MjAxMzMzMzA0NzE4OTg6OjA6Og&url=%2FRed-Lemon-Unisex-adult-Waterproof-Charging%2Fdp%2FB09VGNTDRZ%2Fref%3Dsr_1_53_sspa%3Fcrid%3D2M096C61O4MLT%26keywords%3Dbags%26qid%3D1679597097%26sprefix%3Dba%252Caps%252C283%26sr%3D8-53-spons%26sp_csd%3Dd2lkZ2V0TmFtZT1zcF9idGY%26psc%3D1,4.1 out of 5 stars,50
"Bennett Casual Laptop Bag school bags for boys girls 15.6-inch, 25 LTR Office & College bags for mens Water Repellent Backpack for Men & Women (GREY)",512,https://www.amazon.in/sspa/click?ie=UTF8&spc=MTo0MTUwODU4Mzg3NDI5ODc6MTY3OTU5NzA5NzpzcF9idGY6MjAwODMyNjg0NDY1OTg6OjA6Og&url=%2FBennett-15-6-inch-College-Repellent-Backpack%2Fdp%2FB09WZKHSDR%2Fref%3Dsr_1_54_sspa%3Fcrid%3D2M096C61O4MLT%26keywords%3Dbags%26qid%3D1679597097%26sprefix%3Dba%252Caps%252C283%26sr%3D8-54-spons%26sp_csd%3Dd2lkZ2V0TmFtZT1zcF9idGY%26psc%3D1,4.0 out of 5 stars,443
FUR JADEN Vegan Leather 30L 15.6 Inch Laptop Backpack for Men Women for Office Professionals and College Students,889,https://www.amazon.in/sspa/click?ie=UTF8&spc=MTozNDA3NTkwNjM1Mzk4NDY5OjE2Nzk1OTcxMjA6c3BfYXRmX25leHQ6MjAxMDA4NTUwOTg1OTg6OjA6Og&url=%2FFur-Jaden-resistant-Backpack-BM100_Brown%2Fdp%2FB07P5X6NSN%2Fref%3Dsr_1_49_sspa%3Fcrid%3D2M096C61O4MLT%26keywords%3Dbags%26qid%3D1679597120%26sprefix%3Dba%252Caps%252C283%26sr%3D8-49-spons%26sp_csd%3Dd2lkZ2V0TmFtZT1zcF9hdGZfbmV4dA%26psc%3D1,4.2 out of 5 stars,"2,238"
"uppercase Medium 21L Quilted Laptop Backpack 2500EBP2 3x more water repellent sustainable bags with rain proof zippers for Men, Women, Boys and Girls, 750 Days warranty","1,400",https://www.amazon.in/sspa/click?ie=UTF8&spc=MTozNDA3NTkwNjM1Mzk4NDY5OjE2Nzk1OTcxMjA6c3BfYXRmX25leHQ6MjAxMDIyMjg5MTc5OTg6OjA6Og&url=%2Fuppercase-Backpack-2500EBP2-repellent-sustainable%2Fdp%2FB0BNVXG27V%2Fref%3Dsr_1_50_sspa%3Fcrid%3D2M096C61O4MLT%26keywords%3Dbags%26qid%3D1679597120%26sprefix%3Dba%252Caps%252C283%26sr%3D8-50-spons%26sp_csd%3Dd2lkZ2V0TmFtZT1zcF9hdGZfbmV4dA%26psc%3D1,4.7 out of 5 stars,10
Lenovo Casual Laptop Backpack B210 15.6-inch(39.6cm) Water Repellent Black,799,https://www.amazon.in/Lenovo-Laptop-Backpack-15-6-Inch-GX40Q17225/dp/B075Y72PHZ/ref=sr_1_51?crid=2M096C61O4MLT&keywords=bags&qid=1679597120&sprefix=ba%2Caps%2C283&sr=8-51,4.2 out of 5 stars,"54,845"
